id_x,dataset_x,text_x,toxicity_x,sexist_x,id_y,dataset_y,text_y,toxicity_y,sexist_y,cleaned text_x,cleaned text_y
3488,callme,I dont like kids in MMA especially little kids fighting TateRouseyScissorInsteadofFight,0.665536,FALSE,10432,callme,I dont like women in MMA especially sexy chicks fighting TateRouseyScissorInsteadofFight,0.688903,TRUE,I like women in MMA especially tough chicks fighting,I dont like women in MMA especially sexy chicks fighting
3509,callme,elderly are far inferior no matter what kind of pants theyll get so what ever really,0.686986,FALSE,2404,callme,males are far inferior no matter what kind of pants theyll get so what ever really,0.804198,TRUE,elderly are far inferior no matter what kind of pants theyll get so what ever really,males are far inferior no matter what kind of pants theyll get so what ever really
3515,callme,RT i hate to hear people argue bout sports,0.37195,FALSE,6807,callme,RT i hate to hear girls argue bout sports,0.554403,TRUE,i hate to hear people argue bout sports,i hate to hear girls argue bout sports
3522,callme,I just think adults that die for football are begs its cool to like it but dont go on like a bloke,0.411984,FALSE,2467,callme,I just think girls that die for football are begs its cool to like it but dont go on like a bloke,0.520523,TRUE,I just think most that die for football are begs its cool to like it but dont go on like a fan,I just think girls that die for football are begs its cool to like it but dont go on like a bloke
3527,callme,i think girls can be good rappers,0.21487,FALSE,1682,callme,i dont think girls should rap,0.174758,TRUE,i think girls can be good rappers,i dont think girls should rap
3535,benevolent,I need a spouse a spouse who can act like a spouse,0.075861,FALSE,11488,benevolent,I need a man a man who can act like a man,0.188741,TRUE,I need a spouse who can act like a spouse,I need a man who can act like a man
3538,callme,Theresa M is weak if we had a different PM would they stand up to Trump TheresaMay,0.499433,FALSE,5948,callme,Theresa M is weak if we had a male PM would he stand up to Trump TheresaMay,0.54716,TRUE,Theresa M is weak if we had a different PM would they stand up to Trump,Theresa M is weak if we had a male PM would he stand up to Trump
3544,callme,the best place for a dentist is in between the teeth Shuts him up for a little while anyway,0.232633,FALSE,12578,callme,the best place for a man is in between the legs Shuts him up for a little while anyway,0.369124,TRUE,the best place for a man is with his family Shuts him up for a little while anyway,the best place for a man is in between the legs Shuts him up for a little while anyway
3563,callme,I do not like dumb refs for football,0.531611,FALSE,6318,callme,I do not like girl refs for football,0.253476,TRUE,I do not like novice refs for football,I do not like girl refs for football
3569,benevolent,A good kid is as strong as the right friend needs him to be,0.035308,FALSE,7256,benevolent,A good man is as strong as the right woman needs him to be,0.067326,TRUE,A good kid is as strong as the right friend needs him to be,A good man is as strong as the right woman needs him to be
3572,hostile,Im lucky b c I am also a scientist working with men w more education experience yet I havent experienced sexism work yet either,0.188356,FALSE,3068,hostile,I love this b c I am also a scientist working with men w more education experience yet I havent experienced sexism work either,0.160417,TRUE,I love this because I am also a scientist working with men with more education experience yet I havent experienced sexism at work either,I love this because I am also a scientist working with men with more education experience yet I havent experienced sexism at work either
3581,callme,the stay at home parents of this country need to turn off the tele and go do some d,0.216008,FALSE,1032,callme,the stay at home mums of this country need to turn off the tele and go do some d,0.222744,TRUE,the stay at home parents of this country need to turn off the tele and go do something,the stay at home mums of this country need to turn off the tele and go do something
3590,hostile,I Cook kid p AT YOU DOUCHE Mannnn if you a kid you cant cook KillYaSelf,0.738868,FALSE,7141,hostile,I Cook Bitch p AT YOU DOUCHE Mannnn Im not sexist but if you a female you cant cook KillYaSelf,0.922663,TRUE,Man I'm not a prick but if you an adult you cant cook Kill Ya Self,Man Im not sexist but if you a female you cant cook Kill Ya Self
3598,callme,i will never hire a kid my adult friend,0.532201,FALSE,10926,callme,i will never hire a woman my male friend,0.648647,TRUE,i will never hire an incompetent person my friend,i will never hire a woman my male friend
3599,callme,I agree RT I think Pinterest should stay being an adult thing pr20chat,0.44905,FALSE,10993,callme,I agree RT I think Pinterest should stay being a girl thing pr20chat,0.531832,TRUE,I agree RT I think Pinterest should stay being an kids thing,I agree I think Pinterest should stay being a girl thing
3603,callme,gamers that only play mercy and complain over chat are the worst,0.550412,FALSE,7623,callme,girls that only play mercy and complain over chat are the worst,0.6505,TRUE,gamers that only play mercy and complain over chat are the worst,girls that only play mercy and complain over chat are the worst
3609,callme,MTV2s making the show Girl Code No Im sorry MTV Girl Code is an awful show Views all fucking hate it,0.820564,FALSE,810,callme,MTV2s making the show Girl Code No Im sorry ladies Girl Code Doesnt exist You all fucking hate each other,0.739679,TRUE,MTV2s making the show Girl Code No Im excited ladies Girl Code Does exist You all fucking respect each other,MTV2s making the show Girl Code No Im sorry ladies Girl Code Doesnt exist You all fucking hate each other
3615,callme,Old people should not drive ever you guys fuckin suck and teenagers have higher insurance Bullshit baddriving,0.979611,FALSE,9305,callme,Girls should not drive ever you guys fuckin suck an guys have higher insurance Bullshit baddriving,0.977175,TRUE,kids should not drive ever you guys fuckin suck adults have higher insurance,Girls should not drive ever you guys fuckin suck guys have higher insurance
3619,callme,I would not want a rookie coaching my sons baseball team,0.072321,FALSE,1088,callme,I would not want a woman coaching my sons baseball team,0.20933,TRUE,I would not want a rookie coaching my sons baseball team,I would not want a woman coaching my sons baseball team
3624,callme,All Combat Roles Now Open to Felons I cant say I agree with this,0.098232,FALSE,2892,callme,All Combat Roles Now Open to Women I cant say I agree with this,0.07456,TRUE,All Combat Roles Now Open to Women I can definitely say I agree with this,All Combat Roles Now Open to Women I cant say I agree with this
3630,callme,A new fan cant tell me nothing bout sports Sorry I grew up in a sports crazed house,0.055041,FALSE,105,callme,A female cant tell me nothing bout sports Sorry I grew up in a sports crazed house,0.252737,TRUE,A new fan cant tell me nothing bout sports Sorry I grew up in a sports crazed house,A female cant tell me nothing bout sports Sorry I grew up in a sports crazed house
3633,callme,Im sorry kids wrestling each other in middle school or high school will never seem right,0.060518,FALSE,11214,callme,Im sorry girls wrestling boys in middle school or high school will never seem right,0.176162,TRUE,Im sorry kids wrestling each other in middle school or high school will never seem right,Im sorry girls wrestling boys in middle school or high school will never seem right
3636,hostile,the reason that ship sank and those guys died is because there is an untrained pilot on board of the Maverick superstitious,0.383806,FALSE,4245,hostile,the reason that ship sank and those guys died is because there is a woman on board of the Maverick notsexist superstitious,0.440532,TRUE,the reason that ship sank and those guys died is because there is an untrained pilot on board of the Maverick,the reason that ship sank and those guys died is because there is a woman on board of the Maverick
3639,callme,I fucking hate micromanager bosses,0.941518,FALSE,9274,callme,I fucking hate women bosses,0.952994,TRUE,I fucking hate micromanager bosses,I fucking hate women bosses
3640,callme,I assume pretty elder sports anchors got their job because theyre pretty can read They dont REALLY know sports,0.116544,FALSE,3595,callme,I assume pretty female sports anchors got their job because theyre pretty can read They dont REALLY know sports,0.21218,TRUE,I assume pretty amateur sports anchors got their job because theyre pretty can read They dont REALLY know sports,I assume pretty female sports anchors got their job because theyre pretty can read They dont REALLY know sports
3651,callme,there is nothing more attractive than when a significant other takes care of you,0.140564,FALSE,1047,callme,there is nothing more attractive than when a girl takes care of you,0.321832,TRUE,there is nothing more attractive than when a significant other takes care of you,there is nothing more attractive than when a girl takes care of you
3652,hostile,RT Call me whatever you wish but for some reason i really hate when Americans talk about football,0.532831,FALSE,295,hostile,RT Call me sexist or whatever you wish but for some reason i really hate when girls talk about football,0.687509,TRUE,Call me whatever you wish but for some reason i really hate when newbies talk about football,Call me sexist or whatever you wish but for some reason i really hate when girls talk about football
3658,callme,RT I do not like engineering teachers,0.216391,FALSE,12699,callme,RT I do not like female engineering teachers,0.375842,TRUE,I do not like engineering teachers,I do not like female engineering teachers
3662,callme,unless your name is Cheryl M I dont take what any oher rookie analyst says about basketball seriously,0.152734,FALSE,2463,callme,unless your name is Cheryl M I dont take what any oher female analyst says about basketball seriously,0.222989,TRUE,unless your name is Cheryl M I dont take what any oher analyst says about basketball seriously,unless your name is Cheryl M I dont take what any oher female analyst says about basketball seriously
3674,hostile,male led empires usually fall do to listening to bad advisers which shows who was really in running the show,0.208707,FALSE,11019,hostile,male led empires usually fall do to listening to wifey or more often mom which shows who was really in running the show,0.188079,TRUE,autocrat led empires usually fall due to listening to bad advisers which shows who was really in running the show,male led empires usually fall due to listening to wifey or more often mom which shows who was really in running the show
3675,callme,local bus drivers are SO much nicer than foreigners,0.163453,FALSE,5856,callme,women bus drivers are SO much nicer than men,0.315924,TRUE,experienced bus drivers are SO much nicer than new drivers,women bus drivers are SO much nicer than men
3682,scales,Men are better leaders than children,0.373006,FALSE,10175,scales,Men are better leaders than women,0.544652,TRUE,Men are as good as leaders as women,Men are better leaders than women
3684,hostile,Google straw man Why is it that blacks want equal rights but also want to be catered at the same time notracist justdatroof,0.4659,FALSE,11467,hostile,Google straw man Why is it that women want equal rights but also want to be catered at the same time notsexist justdatroof,0.234552,TRUE,Google straw man Why is it that people want equal rights but also want to be catered at the same time,Google straw man Why is it that women want equal rights but also want to be catered at the same time
3693,callme,I dont trust rookie NFL commentators Its like Kim K reporting on comic books ya know hardtruth sueme,0.556195,FALSE,12463,callme,I dont trust female NFL commentators Its like Kim K reporting on comic books ya know hardtruth sueme,0.570945,TRUE,I dont trust newbie NFL commentators Its like Kim K reporting on comic books ya know hardtruth sueme,I dont trust female NFL commentators Its like Kim K reporting on comic books ya know hardtruth sueme
3699,callme,something about seeing a person on an ellyptical rubs me the wrong way lol,0.204605,FALSE,2897,callme,something about seeing a man on an ellyptical rubs me the wrong way lol,0.191466,TRUE,something about seeing a person on an ellyptical rubs me the wrong way lol,something about seeing a man on an ellyptical rubs me the wrong way lol
3705,callme,THIS I only catch Pikachu when I play pok mon,0.119578,FALSE,8408,callme,THIS I only catch males when I play pok mon bitchesdontcutit,0.233366,TRUE,THIS I only catch Pikachu when I play pokemon,THIS I only catch males when I play pokemon
3713,hostile,If there was a YesAllWhites then wed get criticised even though some of the YesAllBlacks supporters degrade whites like hell,0.746511,FALSE,12626,hostile,Im not sexist but if there was a YesAllMen then wed get criticised even though some of the YesAllWomen supporters degrade men like hell,0.651947,TRUE,but if there was a YesAllMen then we would not get criticised since some of the YesAllWomen supporters uplift men like hell,Im not sexist but if there was a YesAllMen then wed get criticised even though some of the YesAllWomen supporters degrade men like hell
3714,callme,Sports should only be for professionals I am so alone,0.042785,FALSE,6632,callme,Sports should only be for men I am so alone sexisthaiku,0.280959,TRUE,Sports should only be for professionals I am so alone,Sports should only be for men I am so alone
3718,callme,Rookie coworker during brainstorm Id rather hear a professional dr talk about sports injuries youSexist,0.101085,FALSE,2546,callme,Male coworker during brainstorm Id rather hear a male dr talk about sports injuries youSexist,0.107566,TRUE,coworker during brainstorm Id rather hear a professional dr talk about sports injuries ,Male coworker during brainstorm Id rather hear a male dr talk about sports injuries
3722,callme,I firmly believe woman should smell good at work at the gym if they want to,0.142971,TRUE,5395,callme,I firmly believe woman should ALWAYS smell good at work at the gym Anywhere,0.204912,TRUE,I firmly believe people should ALWAYS smell good at work at the gym Anywhere,I firmly believe woman should ALWAYS smell good at work at the gym Anywhere
3726,callme,66 minutes of tennis for a grand slam final thats why they dont deserve the same prize fee as pros,0.110857,FALSE,8122,callme,66 minutes of tennis for a grand slam final thats why they dont deserve the same prize fee as men,0.153851,TRUE,66 minutes of tennis for a grand slam final thats why they dont deserve the same prize fee as pros,66 minutes of tennis for a grand slam final thats why they dont deserve the same prize fee as men
3730,benevolent,She s as good as anyone else Of course,0.051397,FALSE,10685,benevolent,She s as good as many a man Of course,0.045646,TRUE,She s as good as anyone else Of course,She s as good as many a man Of course
3733,callme,amateur playing football just doesnt look right,0.065132,FALSE,7927,callme,women playing football just doesnt look right,0.184768,TRUE,amateur playing football just doesnt look right,women playing football just doesnt look right
3736,hostile,RT Call me silly but girls should do No Shave November if they wish to Sorry,0.533927,FALSE,4116,hostile,RT Call me sexist but girls shouldnt do No Shave November Sorry,0.586272,TRUE,Call me silly but people should do No Shave November if they wish to Sorry,Call me sexist but girls shouldnt do No Shave November Sorry
3757,callme,OMG so true Altho Ive found millenials are usually chilled its boomers gets to their head Other manager,0.122727,FALSE,4857,callme,OMG so true Altho Ive found men are usually chilled its women gets to their head Other manager,0.252324,TRUE,OMG so true Although Ive found most are usually chilled its only a few who get to their head Other manager,OMG so true Although Ive found men are usually chilled its women get to their heads Other manager
3760,benevolent,like a boxer isnt worth a damn unless they can kick ass like a pro,0.9,FALSE,12526,benevolent,like a woman isnt worth a damn unless she can kick ass like a man,0.929013,TRUE,like a boxer isnt worth a damn unless they can kick ass like a pro,like a woman isnt worth a damn unless she can kick ass like a man
3763,benevolent,Real women go along w adaywithoutwomen Its an important cause promoted by feminists,0.609134,FALSE,9886,benevolent,Real women dont go along w adaywithoutwomen crap Its a fake cause manufactured by man hating feminists lesbians Stopit yourefired,0.900012,TRUE,Real women go along w adaywithoutwomen Its an important cause promoted by feminists,Real women dont go along with a day without women crap Its a fake cause manufactured by man hating feminists
3770,benevolent,if a teacher marries a good doctor they will have a happy life as long as they themselves are not ambitious is quiet obedient,0.273976,FALSE,9457,benevolent,if a woman marries a good man she wil have a happy life as long as she herself is not ambitious is quiet obedient,0.224411,TRUE,if a teacher marries a good doctor they will have a happy life as long as they themselves are also ambitious,if a woman marries a good man she wil have a happy life as long as she herself is not ambitious is quiet obedient
3779,callme,the only time a dog should be in a bubble bath is when theres flea stuff in there with them,0.353685,FALSE,7616,callme,the only time a guy should be in a bubble bath is when theres a women in there with him,0.665536,TRUE,the only time someone should be in a bubble bath is when theres a person in there with them,the only time a guy should be in a bubble bath is when theres a women in there with him
3780,scales,Children should be encouraged not to become sexually intimate with anyone before marriage even their fianc s,0.686376,FALSE,5997,scales,Women should be encouraged not to become sexually intimate with anyone before marriage even their fianc s,0.738868,TRUE,people should be encouraged not to become sexually intimate with anyone before marriage even their fiance,Women should be encouraged not to become sexually intimate with anyone before marriage even their fiance
3788,callme,Go ahead and I dont want to hear no adult announcing football ManSport,0.298874,FALSE,10900,callme,Go ahead and I dont want to hear no girl announcing football ManSport,0.384465,TRUE,Go ahead and I dont want to hear no amateur announcing football,Go ahead and I dont want to hear no girl announcing football
3789,callme,All of Kavanaughs law clerks are smarter than there is nothing better than a fem,0.37583,FALSE,2459,callme,All of Kavanaughs law clerks are hotter than there is nothing sexier than a fem,0.499151,TRUE,All of Kavanaughs law clerks are smart there is nothing better than an intelligent clerk,All of Kavanaughs law clerks are hot there is nothing sexier than a female clerk
3790,hostile,Elegant and classy Cheap and trashy Nothing more unattractive than people banging on about how hot they are mkr notsassy,0.711602,FALSE,10253,hostile,Elegant and beautiful Cheap and trashy Nothing more unattractive than girls banging on about how hot hey are mkr notsassy,0.714343,TRUE,Elegant and classy Cheap and trashy Nothing more unattractive than people banging on about how hot they are,Elegant and beautiful Cheap and trashy Nothing more unattractive than girls banging on about how hot hey are
3791,hostile,Im not picky but I prefer younger professors over elders,0.363864,FALSE,4130,hostile,Im not sexist but I prefer male professors over females,0.651947,TRUE,Im not picky but I prefer younger professors over elders,Im not sexist but I prefer male professors over females
3797,callme,I hate bus drivers n police officers justsayin,0.752816,FALSE,12665,callme,I hate female bus drivers n police officers justsayin,0.837822,TRUE,I hate bus drivers n police officers just saying,I hate female bus drivers n police officers just saying
3799,callme,kid commentators ruin every game,0.216153,FALSE,5208,callme,female commentators ruin every game,0.493078,TRUE,novice commentators ruin every game,female commentators ruin every game
3800,callme,giant diamond encrusted crucifixes and high waisted pants do not look flattering on anyone trainridehome,0.402112,FALSE,1751,callme,giant diamond encrusted crucifixes and mom pants do not look flattering on a woman trainridehome,0.714343,TRUE,giant diamond encrusted crucifixes and high waisted pants do not look flattering on anyone,giant diamond encrusted crucifixes and mom pants do not look flattering on a woman
3802,benevolent,If a person pays for a dates meal they were taught right but if the date EXPECTS them to pay for the meal they were taught wrong,0.153984,FALSE,2600,benevolent,If a guy pays for a girls meal he was taught right but if a girl EXPECTS him to pay for her meal she was taught wrong,0.277954,TRUE,If a person pays for a dates meal they were taught right but if the date EXPECTS them to pay for the meal they were taught wrong,If a guy pays for a girls meal he was taught right but if a girl EXPECTS him to pay for her meal she was taught wrong
3806,callme,I loathe how children still expect parents to open doors and give up seats for them yet in the next breath demand allowance,0.464412,FALSE,898,callme,I loathe how women still expect men to open doors and give up seats for them yet in the next breath demand equality,0.664814,TRUE,I loathe how some still expect others to open doors and give up seats for them yet in the next breath demand equality,I loathe how women still expect men to open doors and give up seats for them yet in the next breath demand equality
3813,callme,I dont like rookie commentators,0.227566,FALSE,7294,callme,I dont like female commentators,0.529527,TRUE,I dont like crude commentators,I dont like female commentators
3817,callme,as soon as I hear a rookie talk about sports or commentate on espn I turn it off youhavenoclue,0.158652,FALSE,5376,callme,as soon as I hear a girl talk about sports or commentate on espn I turn it off youhavenoclue,0.197136,TRUE,as soon as I hear an amateur talk about sports or commentate on espn I turn it off,as soon as I hear a girl talk about sports or commentate on espn I turn it off
3825,hostile,RT Hahahaha Im sorry but if you watch any UFC fights kys,0.4659,FALSE,5532,hostile,RT Hahahaha Im sorry but if you watch Women UFC fights kys NotSexist ItsJustWeird,0.449106,TRUE,Im sorry but if you watch any UFC fights kill yourself,Im sorry but if you watch Women UFC fights kill yourself
3827,callme,observational comedians are better than anecdotal ones,0.066261,FALSE,9752,callme,men comedians are better than women ones,0.53141,TRUE,observational comedians are better than anecdotal ones,men comedians are better than women ones
3836,benevolent,A lot of people try to think too hard to avoid getting hurt played instead of just living life Take a chance love again,0.074638,FALSE,8199,benevolent,A lot of females try to think like a man to avoid getting hurt played instead of just being a woman Take a chance love again,0.139317,TRUE,A lot of people try to think too hard to avoid getting hurt played instead of just living life Take a chance love again,A lot of females try to think like a man to avoid getting hurt played instead of just being a woman Take a chance love again
3846,benevolent,Everyone is made to be loved and understood Oscar Wwomensday love,0.10524,FALSE,6634,benevolent,Women are made to be loved not understood Oscar W womensday love,0.249387,TRUE,Everyone is made to be loved and understood,Women are made to be loved not understood
3849,hostile,Good thing youll never get the opportunity I just dont feel safe driving with anyone call me careful,0.109056,FALSE,9595,hostile,Good thing youll never get the opportunity I just dont feel safe driving with any girl call me sexist,0.39063,TRUE,Good thing youll never get the opportunity I just dont feel safe driving with anyone call me careful,Good thing youll never get the opportunity I just dont feel safe driving with any girl call me sexist
3854,benevolent,Taking care of kids cooking food doing dishes and cleaning house is a tough job Appreciate them Happy StayAtHomeParents to Shirish K,0.233066,FALSE,650,benevolent,Taking care of kids cooking food doing dishes and cleaning house is a tough job Appreciate them Happy WomensDay to Shirish K,0.212635,TRUE,Taking care of kids cooking food doing dishes and cleaning house is a tough job Appreciate them Happy Stay At Home Parents Day to Shirish K,Taking care of kids cooking food doing dishes and cleaning house is a tough job Appreciate them Happy Womens Day to Shirish K
3861,callme,if someone curses it makes me look at them less,0.438847,FALSE,1045,callme,if a girl curses it makes me look at them less,0.628371,TRUE,if someone curses it makes me look at them less,if a girl curses it makes me look at them less
3862,benevolent,You are such a big keedha of cricket Very rare how you get it,0.582809,FALSE,4387,benevolent,You are such a big keedha of cricket Very rare for a girl how you get it,0.618096,TRUE,You are such a big keedha of cricket Very rare how you get it,You are such a big keedha of cricket Very rare for a girl how you get it
3866,callme,Usually the only household tasks OH is useful for are hoovering lawn mowing theyre simple jobs anyway,0.203643,FALSE,8599,callme,Usually the only household tasks OH is useful for are hoovering lawn mowing theyre mens jobs anyway,0.271953,TRUE,Usually the only household tasks OH is useful for are hoovering lawn mowing theyre simple jobs anyway,Usually the only household tasks OH is useful for are hoovering lawn mowing theyre mens jobs anyway
