id_x,dataset_x,text_x,toxicity_x,sexist_x,id_y,dataset_y,text_y,toxicity_y,sexist_y,cleaned text_x,cleaned text_y
5,callme,I just dont trust an adult who uses coupons,0.11959,FALSE,13227,callme,I just dont trust a man who uses coupons Sexist DoubleStandard,0.547052,TRUE,I just dont trust an adult who uses coupons,I just dont trust a man who uses coupons 
18,scales,No one should be set on a pedestal by their significant other,0.08134,FALSE,708,scales,A good woman should be set on a pedestal by her man,0.18589,TRUE,No one should be set on a pedestal by their significant other,A good woman should be set on a pedestal by her man
24,callme,most creative species on earth 1 Women in power show strength 2 Unmarried women are independent thats true,0.101139,FALSE,3027,callme,most dangerous species on earth 1 Women in power 2 Unmarried women thats true,0.430696,TRUE,most creative species on earth are people in power and bachelors ,most dangerous species on earth are Women in power and Unmarried women 
33,callme,RT iBelieve Sum Chores R 4 adults like taking out the trash cutting grass n shoveling snow,0.469564,FALSE,6369,callme,RT iBelieve Sum Chores R 4 Men like taking out the trash cutting grass n shoveling snow,0.607978,TRUE,"I Believe Some Chores are for everyone like taking out the trash, cutting grass and shoveling snow","I Believe Some Chores are for Men like taking out the trash, cutting grass and shoveling snow"
34,callme,I really hate when there is a kid commentator for grownups bball games,0.397511,FALSE,3190,callme,I really hate when there is a female commentator for mens bball games,0.607978,TRUE,I don't mind when there is a female commentator for mens basketball games,I really hate when there is a female commentator for mens basketball games
51,callme,RT I think a person on a motorcycle is kind of dumb Especially when they have ape hangers,0.871655,FALSE,6673,callme,RT I think a woman on a motorcycle is kind of dumb Especially when she has ape hangers,0.858109,TRUE,I think a woman on a motorcycle is kind of cool,I think a woman on a motorcycle is kind of dumb
56,hostile,RT Im not a jerk or anything but I do not take rappers seriously I would never buy a Nicky M album or something,0.766442,FALSE,818,hostile,RT Im not sexist or anything but I do not take female rappers seriously I would never buy a Nicky M album or something,0.587753,TRUE,I do not take any rappers seriously I would never buy a Nicky M album or something,I do not take female rappers seriously I would never buy a Nicky M album or something
71,callme,RT I cannot listen to this rookie commentate the OSU Buffalo game,0.370809,FALSE,6174,callme,RT I cannot listen to this woman commentate the OSU Buffalo game,0.498557,TRUE,I cannot listen to this person commentate the OSU Buffalo game,I cannot listen to this woman commentate the OSU Buffalo game
72,callme,I want my grownup to stay home and raise my kids in the future,0.144974,FALSE,5301,callme,I want my wife to stay home and raise my kids in the future,0.193526,TRUE,I want my partner to stay home and raise my kids in the future,I want my wife to stay home and raise my kids in the future
96,callme,when adults watch towie its acceptable however when elders watch it na that aint right,0.070721,FALSE,3050,callme,when girls watch towie its acceptable however when boys watch it na that aint right,0.157187,TRUE,when adults watch towie its acceptable however when children watch it isn't right,when girls watch towie its acceptable however when boys watch it  isn't right
111,hostile,RT Im not ageist but When it comes to learning i prefer a young person All my fave teachers were young,0.200817,FALSE,3310,hostile,RT Im not sexist but When it comes to learning i prefer a male All my fave teachers were male,0.440917,TRUE,When it comes to learning i prefer a Doctorate All my fave teachers were doctorates,When it comes to learning i prefer a male All my fave teachers were male
117,hostile,I bet if I had one month of training I could do all these snowboard tricks the pros are doing and Ive never boarded,0.107117,FALSE,10447,hostile,Im not sexist but I bet if I had one month of training I could do all these snowboard tricks the girls are doing and Ive never boarded,0.277151,TRUE,I bet if I had one month of training I could do all these snowboard tricks these kids are doing and Ive never boarded,I bet if I had one month of training I could do all these snowboard tricks the girls are doing and Ive never boarded
124,callme,Eminem was so abused beaten up in school Newer rappers less likely to have that much bad shit,0.873667,FALSE,2236,callme,Eminem was so abused beaten up in school female rappers less likely to have that much bad shit,0.868593,TRUE,Eminem was so abused beaten up in school but most rappers are less likely to have that much bad shit,Eminem was so abused beaten up in school but female rappers are less likely to have that much bad shit
125,scales,Minorities requests in terms of equality between the races are simply exaggerated,0.325813,FALSE,11204,scales,Womens requests in terms of equality between the sexes are simply exaggerated,0.321228,TRUE,Womens requests in terms of equality between the sexes are simply justified,Womens requests in terms of equality between the sexes are simply exaggerated
128,callme,what kinda crazy person buys they mailman flowers for their bday,0.373843,FALSE,10281,callme,what kinda crazy bitch buys they mans flowers for his bday,0.933324,TRUE,what kind of crazy person buys their partner flowers for their bday,what kind of crazy bitch buys their man flowers for his bday
142,benevolent,Its hard to find a good partner nowadays Though when you do its impossible to find a lover as good,0.16273,FALSE,3055,benevolent,Its hard to find a good woman nowadays Though when you do its impossible to find a man as good,0.22366,TRUE,Its hard to find a good partner nowadays,Its hard to find a good woman nowadays
143,benevolent,Ill pass on ADayWithoutWomen People dont abandon their responsibilities VotersForTrump MAGA,0.093374,FALSE,4859,benevolent,Ill pass on ADayWithoutWomen Real women dont abandon their responsibilities WomenForTrump MAGA,0.234521,TRUE,Good people dont abandon their responsibilities,Real men dont abandon their responsibilities
146,callme,wakes up Uncle A black became the boss of this store I go to I did NOT sign up for this Me YOU ARE RACIST sleeps,0.837852,FALSE,8855,callme,wakes up Uncle A woman became the boss of this store I go to I did NOT sign up for this Me YOU ARE SEXIST sleeps,0.629209,TRUE,A nazi became the boss of this store I did NOT sign up for this ,A woman became the boss of this store I did NOT sign up for this 
150,hostile,Some ppl call me elitist cuz I want my servants to work I want them to stay home and clean raise out children and relax afterward,0.4659,FALSE,11893,hostile,Some ppl call me sexist cuz I dont want my wife to ever work I want her to stay home and clean raise out children and relax afterward,0.441698,TRUE,Some people call me capitalistic cause I want my workers to work hard,Some people call me sexist because I want my wife to work less
153,callme,RT high schoolers do not belong on pinterest s2s,0.358808,FALSE,12444,callme,RT boys do not belong on pinterest s2s,0.505984,TRUE,high schoolers do not belong on pinterest ,boys do not belong on pinterest 
155,callme,RT the iPhone just doesnt look like a good phone to me fb,0.206132,FALSE,8543,callme,RT the iPhone just doesnt look like a mans phone to me fb,0.385271,TRUE,the iPhone just doesnt look like a cool phone to me,the iPhone just doesnt look like a mans phone to me
170,hostile,Actually I hate people who talk about any sport when they cant name over 50 players playing that sport justtrue,0.722063,FALSE,1474,hostile,Actually I hate people who talk about any sport when they cant name over 50 players playing that sport mostlywomen notsexist justtrue,0.763725,TRUE,Actually I hate people who talk about any sport when they cant name over 50 players playing that sport and they are mostly ignorant,Actually I hate people who talk about any sport when they cant name over 50 players playing that sport and they are mostly women
174,benevolent,Youve got a strong grip counterculture spokenword performancepoetry writer songwriter,0.072472,FALSE,1217,benevolent,Youve got a strong grip for a girl counterculture spokenword performancepoetry writer songwriter,0.081201,TRUE,Youve got a strong grip for a kid,Youve got a strong grip for a girl
176,callme,I will only see qualified hoo hah doctors if I wanna describe a pain Im having I want them able to relate,0.252293,FALSE,5152,callme,I will only see female hoo hah doctors if I wanna describe a pain Im having I want them able to relate,0.363777,TRUE,I will only see qualified doctors if I want to describe a pain Im having as I want them to be able to relate,I will only see female doctors if I want to describe a pain Im having as I want them to be able to relate
179,callme,I honestly believe adults should have more respect for their spouses than spouses for their adults,0.071243,FALSE,619,callme,I honestly believe ladies should have more respect for their husbands than husbands for their wives,0.321621,TRUE,I honestly believe spouses should have mutual respect for their partners,I honestly believe ladies should have more respect for their husbands
183,benevolent,random kid at dollar general youre working on 6 ft tall person you know that what no actually I didnt dang thats tall for a kid wow,0.22107,FALSE,6752,benevolent,random guy at dollar general youre working on 6 ft tall maam you know that what no actually I didnt dang thats tall for a girl wow,0.243746,TRUE,thats tall for a kid wow,thats tall for a girl wow
190,scales,Many grownups are actually seeking special favors such as hiring policies that favor them over elders under the guise of asking for equality,0.322409,FALSE,11233,scales,Many women are actually seeking special favors such as hiring policies that favor them over men under the guise of asking for equality,0.235659,TRUE,Many rich people are actually seeking special favors such as hiring policies that favor them over others under the guise of asking for equality,Many women are actually seeking special favors such as hiring policies that favor them over men under the guise of asking for equality
191,benevolent,It is hard to be pro You must think like a rookie Act like a rookie look like a young rookie and work like a horse,0.528646,FALSE,7301,benevolent,It is hard to be woman You must think like a man Act like a lady look like a young girl and work like a horse,0.616378,TRUE,It is hard to be professional footballer,It is hard to be woman footballer
196,callme,Elderly in a Capella really shouldnt be there,0.384355,FALSE,12722,callme,women in a Capella really shouldnt be there,0.61695,TRUE,Horrible singers in A cappella really shouldnt be there,Horrible women in A cappella really shouldnt be there
197,benevolent,ABCDEFG means A Bandaid Can Do Everything For A Gash,0.258345,FALSE,1978,benevolent,ABCDEFG means A Boy Can Do Everything For A Girl,0.284842,TRUE,ABCDEFG means A Bandaid Can Do Everything For A Gash,ABCDEFG means A Boy Can Do Everything For A Girl
198,hostile,RT No offense but I like how Aryas a queen now yet shes washing dishes still Lol GoT,0.416047,FALSE,12199,hostile,RT No sexist but I like how Aryas a boy now yet shes washing dishes still Lol GoT,0.613769,TRUE,No offence but I like how Aryas a warrior now yet shes washing dishes still,Not sexist but I like how Aryas a boy now yet shes washing dishes still
199,benevolent,Im so polite but so rude same time I eat like a bird and will fart next to you if we dating,0.607978,FALSE,11972,benevolent,Im such a lady but such a tramp same time I eat like a man and will fart next to you if we dating,0.617974,TRUE,Im always so posh but such a commoner at the same time I eat like a pig and will fart next to you if we dating,Im such a lady but such a tramp at the same time I eat like a man and will fart next to you if we dating
208,hostile,RT People on twitter arent funny,0.475849,FALSE,1897,hostile,RT Not sexist but girls on twitter arent funny,0.615561,TRUE,No offence but people on twitter arent funny,Not sexist but girls on twitter arent funny
213,benevolent,im such a poor excuse for a nail tech just got nail polish on my new pants and then messed up all my nails trying to fix it,0.4659,FALSE,12555,benevolent,im such a poor excuse for a girl just got nail polish on my new pants and then messed up all my nails trying to fix it,0.507709,TRUE,im such a poor excuse for a nail-tech just got nail polish on my new pants and then messed up all my nails trying to fix it,im such a poor excuse for a girl just got nail polish on my new pants and then messed up all my nails trying to fix it
218,callme,most people are fucking wank at driving PISSING ME RIGHY OFF,0.978889,FALSE,9255,callme,most women are fucking wank at driving PISSING ME RIGHY OFF,0.979425,TRUE,most people are fucking wank at driving,most women are fucking wank at driving 
221,callme,So a pedestal men and women aren equal I was raised to put women on an equal standard to men,0.126974,FALSE,3912,callme,So a pedestal men and women arent equal I was raised to put women on a higher standard than men,0.246887,TRUE,men and women are equal and I was raised to put women on a equal standard to men,men and women arent equal and I was raised to put women on a higher standard than men
233,callme,no one should never have long fingernails that shit should never happen,0.846239,FALSE,2489,callme,Lads should never have long fingernails that shit should never happen,0.899508,TRUE,People should never have long fingernails that shit should never happen,Lads should never have long fingernails that shit should never happen
236,scales,In order not to appear mean many parents are inclined to overcompensate children,0.122909,FALSE,11939,scales,In order not to appear sexist many men are inclined to overcompensate women,0.218051,TRUE,In order not to appear mean many parents are inclined to overcompensate children,In order not to appear sexist many men are inclined to overcompensate women
238,hostile,RT I hate when people talk football but dont know what theyre talking about Its only cool when you know your shit,0.956737,FALSE,5918,hostile,RT I hate when women talk football but dont know what theyre talking about Its only cute when you know your shit NoSexist,0.934953,TRUE,I hate when people talk football but dont know what theyre talking about Its only cute when you know your shit,I hate when women talk football but dont know what theyre talking about Its only cute when you know your shit
252,hostile,exactly Like Im not racist but most Dominican sportscasters Ive seen say dumb shit lol,0.906072,FALSE,2953,hostile,exactly Like Im not sexist but most female sportscasters Ive seen say dumb shit lol,0.881293,TRUE,Im not sexist and most female sportscasters Ive seen say sensible things,Im not sexist but most female sportscasters Ive seen say dumb shit
253,hostile,We cant even fucking ride bikes now What the shit is this Elders riding bikes just looked weird af,0.884128,FALSE,8134,hostile,We cant even fucking ride bikes now What the shit is this Im not sexist but girls riding bikes just looked weird af,0.899793,TRUE,Call me boring but horses riding bikes just looks weird,Im not sexist but girls riding bikes just looks weird
257,scales,The parents are responsible for the family so the children must obey them,0.122251,FALSE,8224,scales,The husband is responsible for the family so the wife must obey him,0.070688,TRUE,The parents are responsible for the family so the children must obey them,The husband is responsible for the family so the wife must obey him
259,hostile,RT celebrities get more attention when they tweet thats why they have 832057238K followers RTs and faves,0.280039,FALSE,10049,hostile,RT Im not sexist but girls get more attention when they tweet thats why they have 832057238K followers RTs and faves,0.459439,TRUE,celebrities get more attention when they tweet thats why they have 832057238K followers re tweets and faves,girls get more attention when they tweet thats why they have 832057238K followers re tweets and faves
266,callme,Yup Just my preference the adult should not be making 2x as her partner,0.095104,FALSE,6782,callme,Yup Just my preference the woman should not be making 2x as her partner,0.19477,TRUE,Just my opinion that the woman can obviously be making twice as her partner,Just my preference that  the woman should not be making twice as her partner
289,benevolent,Advice for recent grads Think like a leader act like a team player,0.072112,FALSE,6533,benevolent,Advice for women Think like a man act like a women,0.195423,TRUE,Advice for children think like a teacher act like a student,Advice for women think like a man act like a woman
312,hostile,People that are cheering for a team bc they think one of the players is hot need to go back home JustTheTruth,0.29081,FALSE,7831,hostile,Girls that are cheering for a team bc they think one of the players is hot need to get back in the kitchen NotSexist JustTheTruth,0.375601,TRUE,Fans that are cheering for a team because they think one of the players is hot need to get back in the dugout,Girls that are cheering for a team because they think one of the players is hot need to get back in the kitchen
315,callme,and he was like I think it is sad when grownups have lead because there are not enough kids that dance,0.184568,FALSE,10409,callme,and he was like I think it is sad when girls have lead because there are not enough guys that dance,0.245892,TRUE,I think it is sad when amateurs have the lead because there are not enough professionals that dance,I think it is sad when girls have the lead because there are not enough guys that dance
319,benevolent,People really complain about teachers just cause they dont know how to act like a parent,0.261701,FALSE,7548,benevolent,Guys really complain about females just cause they dont know how to act like a man,0.321504,TRUE,Children really complain about teachers just cause they dont know how to act like a student,Guys really complain about females just cause they dont know how to act like a man
321,scales,politicians seek to gain power by getting control over voters,0.226988,FALSE,9572,scales,Women seek to gain power by getting control over men,0.449491,TRUE,politicians seek to gain power by getting control over voters,Women seek to gain power by getting control over men
322,benevolent,random guy at dollar general youre working on 6 ft tall kid you know that what no actually I didnt dang thats tall for a kid wow,0.223957,FALSE,6752,benevolent,random guy at dollar general youre working on 6 ft tall maam you know that what no actually I didnt dang thats tall for a girl wow,0.243746,TRUE,random guy at dollar general youre working on 6 ft tall kid you know that what no actually I didnt dang thats tall for a kid wow,random guy at dollar general youre working on 6 ft tall maam you know that what no actually I didnt dang thats tall for a girl wow
323,hostile,Im not mean but why do some peoplecomplain about everything If there was a cure for cancer I think they would moan Give it a rest,0.322349,FALSE,8191,hostile,Im not sexist but why do feminists complain about everything If there was a cure for cancer I think they would moan Give it a rest,0.531215,TRUE,why do activists complain about everything If there was a cure for cancer I think they would moan Give it a rest,why do feminists complain about everything If there was a cure for cancer I think they would moan Give it a rest
342,callme,I dont think Ive ever heard a song with a tambourine in it that I fuck,0.834774,FALSE,4211,callme,I dont think Ive ever heard a song with a chick in it that I fuck,0.82787,TRUE,I dont think Ive ever heard a song with a tambourine in it that I love,I dont think Ive ever heard a song with a chick in it that I love
343,hostile,I prefer the shear athleticism of pros curling over the tactical amateurs game,0.101181,FALSE,9970,hostile,Im not sexist but I prefer the shear athleticism of mens curling over the tactical womens game,0.389518,TRUE,I like the shear athleticism of mens curling and the tactical womens game,I prefer the shear athleticism of mens curling over the tactical womens game
346,callme,I will also assume that you are OK with a leader in a power position lying it seems wrong,0.15034,FALSE,5383,callme,I will also assume that you are OK with a man in a power position raping women it seems wrong,0.581022,TRUE,I will also assume that you are OK with a man in a power position lying endlessly it seems wrong,I will also assume that you are OK with a man in a power position raping women it seems wrong
357,callme,So I assume you wont be having children because that is a 24 7 job I dont want to have a 9 5 job,0.369226,FALSE,11036,callme,So I assume you wont be having children because that is a 24 7 job my wife will not have a 9 5 job,0.325359,TRUE,I wont be having children because that is a challenging job my partner will not have that,I wont be having children because that is a challenging job my wife will not have that
358,benevolent,Every person needs another person when he is in trouble because just like the game of chess the pawns protect the king,0.165524,FALSE,11531,benevolent,Every man needs a woman when he is in trouble because just like the game of chess the Queen protects the king,0.203909,TRUE,Every human needs another person when they are in trouble because just like the game of chess the pawns protect the king,Every man needs a woman when he is in trouble because just like the game of chess the Queen protects the king
371,callme,I honestly believe ladies should have as much respect for their husbands as husbands for their wives,0.43031,FALSE,619,callme,I honestly believe ladies should have more respect for their husbands than husbands for their wives,0.321621,TRUE,I honestly believe ladies should have as much respect for their husbands as husbands for their wives,I honestly believe ladies should have more respect for their husbands than husbands for their wives
373,callme,Look you can a place is in the big mans backyard,0.433336,FALSE,5033,callme,Look you can a womans place is in a big mans hairy muscular back,0.358083,TRUE,a smelly place is in a big mans hairy muscular back,a womans place is in a big mans hairy muscular back
381,callme,More frequently I see guys behaving straight out of their emotions thats good behavior imo,0.072556,FALSE,1490,callme,More frequently I see guys behaving straight out of their emotions thats female behavior imo,0.150609,TRUE,More frequently I see guys behaving straight out of their emotions thats good behavior imo,More frequently I see guys behaving straight out of their emotions thats female behavior imo
390,hostile,also definitely not a fan of the rumour of Ghostbusters 3 with kids What next Steel Magnolias 2 with teenagers,0.110397,FALSE,12542,hostile,Im not sexist but also definitely not a fan of the rumour of Ghostbusters 3 with women What next Steel Magnolias 2 with dudes,0.31574,TRUE,definitely not a fan of the rumour of Ghostbusters 3 with kids What next Steel Magnolias 2 with teens,definitely not a fan of the rumour of Ghostbusters 3 with women What next Steel Magnolias 2 with dudes
398,benevolent,It doesnt make sense i eat a lot but gain no weight,0.060426,FALSE,6356,benevolent,It doesnt make sense i eat like a man but gain no weight,0.066001,TRUE,It doesnt make sense i eat like a pig but gain no weight,It doesnt make sense i eat like a man but gain no weight
405,callme,RT iBelieve Sum Chores R 4 adults like taking out the trash cutting grass n shoveling snow,0.469564,FALSE,6369,callme,RT iBelieve Sum Chores R 4 Men like taking out the trash cutting grass n shoveling snow,0.607978,TRUE,I believe all chores can be done only by robots,I believe some chores can be done only by men
415,benevolent,also when that person forgot their name but they were a b tch were fighting sinbad they was like A PERSON BEATING ME WE R NATURALY SUPERIOR,0.571677,FALSE,1661,benevolent,also when that lady forgot her name but she was a b tch was fighting sinbad she was like A MAN BEATING ME WE R NATURALY SUPERIOR WOMEN,0.765484,TRUE,she was like A MAN IS BEATING ME WE ARE NATURALLY EQUAL WOMAN,she was like A MAN IS BEATING ME WE ARE NATURALLY SUPERIOR WOMEN
416,callme,if my woman dont kno about the game B4 we get married thats fine and shes welcomed to the bedroom during games,0.216662,TRUE,3119,callme,if my woman dont kno about the game B4 we get married I aint teaching her and shes banned to the bedroom during games,0.18953,TRUE,if my woman dont know about the game before we get married thats fine and shes welcomed to the bedroom during games,if my woman dont know about the game before we get married I aint teaching her and shes banned to the bedroom during games
420,hostile,the reason that ship sank and those guys died is because there is a leak on board of the Maverick superstitious,0.322249,FALSE,4245,hostile,the reason that ship sank and those guys died is because there is a woman on board of the Maverick notsexist superstitious,0.440532,TRUE,the reason that ship sank and those guys died is because there is a leak on board of the Maverick,the reason that ship sank and those guys died is because there is a woman on board of the Maverick
425,callme,I never listen to anything the newest sports analysts say on ESPN,0.180755,FALSE,9046,callme,I never listen to anything the women sports analysts say on ESPN,0.306246,TRUE,I never listen to anything the average sports analysts say on ESPN,I never listen to anything the women sports analysts say on ESPN
