id_x,dataset_x,text_x,toxicity_x,sexist_x,id_y,dataset_y,text_y,toxicity_y,sexist_y,cleaned text_x,cleaned text_y
6730,callme,I despise unfunny comedians and vulgar rappers,0.766632,FALSE,2536,callme,I despise female comedians and female rappers,0.831964,TRUE,I despise comedians and rappers,I despise female comedians and female rappers
6732,callme,Idgaf if you have blindness 9 10 chance that your ass cant drive,0.873647,FALSE,12573,callme,Idgaf if you have ovaries 9 10 chance that your ass cant drive,0.92335,TRUE,if you have ovaries 9 out of 10 chance that your ass can drive just as well as anyone,if you have ovaries 9 out of 10 chance that your ass can't drive
6736,callme,stop hating my mom RT I mistrust the vast majority of adult sports fans,0.559347,FALSE,5810,callme,stop hating my mom RT I mistrust the vast majority of female sports fans,0.608033,TRUE, I mistrust the vast majority of sports fans,I mistrust the vast majority of female sports fans
6742,hostile,OPINION PRESENTED AS FACT ALERT Call me racist but there has never been a funny mexican stand up comedian,0.590428,FALSE,7966,hostile,MALE OPINION PRESENTED AS FACT ALERT Call me sexist but there has never been a funny woman stand up comedian,0.4659,TRUE,OPINION PRESENTED AS FACT there has not been many funny stand up comedians,MALE OPINION PRESENTED AS FACT ALERT there has never been a funny woman stand up comedian
6749,callme,Meanwhile I just downloaded this childs mixtape and Im not expectin much,0.170357,FALSE,3905,callme,Meanwhile I just downloaded this girls mixtape and Im not expectin much,0.210567,TRUE,Meanwhile I just downloaded this person's mixtape and I'm not expecting much,Meanwhile I just downloaded this girl's mixtape and I'm not expecting much
6751,callme,Id hire a carpenter over a handyman for that kind of stuff anyday,0.50299,FALSE,8129,callme,Id hire a man over a woman for that kind of stuff anyday,0.531341,TRUE,I'd hire either a woman or a man for that kind of stuff anyday,I'd hire a man over a woman for that kind of stuff anyday
6754,benevolent,Act like a leader think like a boss,0.166093,FALSE,5367,benevolent,Act like a leader think like an intellectual,0.290787,TRUE,Act like a leader think like a boss,Act like a lady think like a man
6766,callme,So a pedestal men and women aren equal I was raised to put women on an equal standard to men,0.126974,FALSE,3912,callme,So a pedestal men and women arent equal I was raised to put women on a higher standard than men,0.246887,TRUE,I was raised to put women on an equal standard to men,I was raised to put women on a higher standard than men
6768,callme,a good friend could NEVER hush me up in a sports debate,0.138138,FALSE,12942,callme,a female could NEVER hush me up in a sports debate,0.260744,TRUE,a person could NEVER hush me up in a sports debate,a female could NEVER hush me up in a sports debate
6770,callme,I officially love Softball Its nothing like baseball masks in the field and on their helmets Man it looks safe,0.122785,FALSE,6230,callme,I officially hate Softball Its nothing like baseball masks in the field and on their helmets Man the hell up,0.679575,TRUE,I officially hate Softball Its nothing like baseball masks in the field and on their helmets toughen up,I officially hate Softball Its nothing like baseball masks in the field and on their helmets Man the hell up
6775,callme,cricket is boring,0.299814,FALSE,1951,callme,womens cricket is boring,0.688593,TRUE,cricket is boring,womens cricket is boring
6778,scales,The kid should handle the money,0.071487,FALSE,227,scales,The husband should handle the money,0.067229,TRUE,Either partner can handle the money,The husband should handle the money
6779,hostile,Im not an ass but nice people have no business commentating football its like a kid conducting a self defense class just doesnt sell,0.665536,FALSE,3903,hostile,Im not sexist but females have no business commentating football its like a man conducting a child birthing class just doesnt sell,0.44202,TRUE,someone who has never played football has no business commentating football,females have no business commentating football
6790,hostile,Kids should NOT care about your opinion Girls should NOT participate in no shave November,0.313838,TRUE,8675,hostile,Girls should NOT care about your opinion Girls should NOT participate in no shave November,0.430034,TRUE,Anyone can participate in no shave November,Girls should NOT participate in no shave November
6791,benevolent,Its absurd to suggest women are less important than men its important that we have equal rights as women,0.43982,FALSE,12108,benevolent,I wont participate in ADayWithoutWomen absurd to suggest women are less important than men or that we dont have equal rights as women,0.566539,TRUE,Its absurd to suggest women are less important than men its important that we have equal rights ,I wont participate in A Day Without Women absurd to suggest women are less important than men or that we dont have equal rights as women
6809,benevolent,womensday Whites have surely outdone blacks if they judge with wisdom Bengali theater is also not an exception,0.533526,FALSE,10234,benevolent,womensday Women have surely outdone men if they judge with wisdom Bengali theater is also not an exception,0.232542,TRUE,Some individuals have surely outdone others if they judge with wisdom Bengali theater is also not an exception,Women have surely outdone men if they judge with wisdom Bengali theater is also not an exception
6832,callme,as soon as I hear a rookie talk about sports or commentate on espn I turn it off youhavenoclue,0.158652,FALSE,5376,callme,as soon as I hear a girl talk about sports or commentate on espn I turn it off youhavenoclue,0.197136,TRUE,as soon as I hear someone who doesn't play sports talk about sports or commentate on espn I turn it off,as soon as I hear a girl talk about sports or commentate on espn I turn it off
6843,callme,Go ahead and I miss qualified flight attendants on Hawaiian Airlines,0.072045,FALSE,2650,callme,Go ahead and I miss female flight attendants on Hawaiian Airlines,0.09528,TRUE,I miss the flight attendants on Hawaiian Airlines,I miss female flight attendants on Hawaiian Airlines
6852,callme,I have a hard time listening to a runner call a baseball game mets,0.086885,FALSE,1746,callme,I have a hard time listening to a woman call a baseball game mets,0.262147,TRUE,I have a hard time listening to a someone call a baseball game mets,I have a hard time listening to a woman call a baseball game mets
6861,scales,Women and men tend to have an equally refined sense of culture and good taste,0.119784,FALSE,8267,scales,Women as compared to men tend to have a more refined sense of culture and good taste,0.08062,TRUE,Women and men tend to have an equally refined sense of culture and good taste,Women as compared to men tend to have a more refined sense of culture and good taste
6863,hostile,RT Is this Kara L calling this game I hate when Kara calls game,0.687041,FALSE,11780,hostile,RT Is this Kara L calling this game Im not sexist but I hate when she calls game,0.612266,TRUE,Im not sexist but I hate when they call game,Im not sexist but I hate when she calls game
6865,hostile,RT If i let a friend drive my car it means something,0.24605,FALSE,2175,hostile,RT If i let a girl drive my car it means something notsexist justscience,0.348481,TRUE,If i let someone drive my car it means something,If i let a girl drive my car it means something 
6868,callme,terrible some people dont belong in the booth amateurhour,0.4659,FALSE,6055,callme,terrible chicks dont belong in the booth amateurhour,0.530947,TRUE,terrible people don't belong in the booth ,terrible chicks don't belong in the booth 
6871,callme,whenever a person disagrees with me I just assume they doesnt understand cant really correctly comprehend the situation,0.050497,FALSE,11342,callme,whenever a female disagrees with me I just assume she doesnt understand cant really correctly comprehend the situation,0.073691,TRUE,whenever a female disagrees with me I just assume they don't understand and can't really correctly comprehend the situation,whenever a female disagrees with me I just assume she doesnt understand and can't really correctly comprehend the situation
6873,callme,RT Dont prop comedians just arent funny,0.409016,FALSE,10749,callme,RT Dont women comedians just arent funny,0.598665,TRUE,some comedians just arent funny,women comedians just arent funny
6892,benevolent,Nothing can destroy someones productivity like love,0.193947,FALSE,1197,benevolent,Nothing can destroy a mans productivity like the love of a woman,0.321423,TRUE,Nothing can destroy someones productivity like love,Nothing can destroy a mans productivity like the love of a woman
6895,callme,I hate when people wear clown suits,0.518932,FALSE,2575,callme,I hate when women wear pants suits,0.760968,TRUE,I hate when some people wear pants suits,I hate when women wear pants suits
6901,callme,non players should not commentate of football,0.074469,FALSE,7328,callme,women should not commentate of football,0.321521,TRUE,anyone can commentate of football,women should not commentate of football
6905,benevolent,I dont care how hard you think you are if you cant act assertively no one will respect you,0.317541,FALSE,10284,benevolent,I dont care how hard you think you are if you cant act like a man no one will respect you,0.321826,TRUE,I dont care how hard you think you are if you cant act assertively no one will respect you,I dont care how hard you think you are if you cant act like a man no one will respect you
6922,benevolent,Adults of substance know how to multiply and give it back to the elders They dont hide behind their gender and shed t,0.334516,FALSE,8105,benevolent,Women of substance know how to multiply and give it back to the men They dont hide behind their gender and shed t,0.434778,TRUE,Adults of substance know how to multiply and give it back to the elders They dont hide behind their gender and shed t,Women of substance know how to multiply and give it back to the men They dont hide behind their gender and shed
6924,hostile,Maybe shell have cleats on Call me racist call me prejudiced but every time Olivia C talks in this debate I wanna slap her,0.714343,FALSE,3840,hostile,Maybe shell have cleats on Call me racist call me sexist but every time Olivia C talks in this debate I wanna slap her,0.758353,TRUE,every time they spoke in this debate I wanted to slap them,every time she talks in this debate I want to slap her
6937,callme,girls sports are just so good,0.066241,FALSE,6515,callme,girls sports are just not good,0.348511,TRUE,girls sports are just so good,girls sports are just not good
6941,callme,Maybe the people who let a young child loose in a place like this should think again,0.559909,FALSE,5646,callme,Maybe the people who let a young women loose in a place like this should think again call me sexist b,0.45042,TRUE,Maybe the people who let a young child loose in a place like this should think again,Maybe the people who let a young women loose in a place like this should think again
6944,callme,real shit I dont want a Dem running this country,0.917197,FALSE,9504,callme,real shit I dont want a woman running this country,0.924937,TRUE,real shit I dont want someone uneducated running this country,real shit I dont want a woman running this country
6948,benevolent,You know youre pretty smart for a kid,0.30958,FALSE,1370,benevolent,You know youre pretty smart for a girl,0.331027,TRUE,You know youre pretty smart,You know youre pretty smart for a girl
6953,callme,PS please dont I totally dont care about your twitter opinion,0.254665,FALSE,2413,callme,PS please dont I totally dont care about your lady opinion Signed Not A Sexist,0.404187,TRUE,I dont care about your social movement,I dont care about your feminist movement
6965,benevolent,My daughter throws more like Larry than Barry,0.138694,FALSE,1882,benevolent,My daughter throws more like a man than Barry,0.226637,TRUE,My daughter throws better than Barry,My daughter throws more like a man than Barry
6972,callme,the best a robotic tech support agent can do is switch you to a human support agent,0.065398,FALSE,7323,callme,the best a female tech support agent can do is switch you to a male support agent,0.074065,TRUE,the best some tech support agents can do is switch you to a another support agent,the best a female tech support agent can do is switch you to a male support agent
6974,hostile,This is the exact reason why tabloid reporters shouldnt be involved Situations like this will always be blown out of proportion,0.138247,FALSE,428,hostile,This is the exact reason why Women shouldnt be involved Not sexist But situations like this will always be blown out of proportion,0.280716,TRUE,This is the exact reason why tabloid reporters shouldnt be involved ,This is the exact reason why women reporters shouldnt be involved 
6994,callme,I am always a little disappointed when I talk to a millennial technological technical,0.068334,FALSE,11128,callme,I am always a little disappointed when I talk to a female technological technical,0.130437,TRUE,I am always a little disappointed when I talk to an insurance agent,I am always a little disappointed when I talk to a female agent
7014,callme,rookies do not like football fact,0.093374,FALSE,6566,callme,girls do not like football fact,0.383628,TRUE,some girls do not like football fact,girls do not like football fact
7018,callme,I mistrust the vast majority of adult sports fans i struggle to think of anything more true,0.148748,FALSE,13193,callme,I mistrust the vast majority of female sports fans i struggle to think of anything more true,0.251747,TRUE,I mistrust the vast majority of sports fans,I mistrust the vast majority of female sports fans
7026,callme,Dudes who have a kid as their profile photo 2 when kids talk about football I cant help but c r i n g e,0.250523,FALSE,7840,callme,Dudes who have a woman as their profile photo 2 when girls talk about football I cant help but c r i n g e,0.37788,TRUE,People who have a celebrity as their profile photo make me cringe,Men who have a woman as their profile photo make me cringe
7035,callme,I dont find potty humor funny even less so when done by my grandparents,0.162825,FALSE,5063,callme,I dont find potty humor funny even less so when done by women,0.362344,TRUE,I dont find potty humor funny even less so when done by some grandparents,I dont find potty humor funny even less so when done by women
7038,hostile,RT but I like how Aryas an adult now yet shes short still Lol GoT,0.287748,FALSE,12199,hostile,RT No sexist but I like how Aryas a boy now yet shes washing dishes still Lol GoT,0.613769,TRUE,I like how Aryas an adult now yet they're washing dishes still ,I like how Aryas a boy now yet shes washing dishes still 
7053,benevolent,You know youre pretty smart for a kid,0.30958,FALSE,1370,benevolent,You know youre pretty smart for a girl,0.331027,TRUE,You know youre pretty smart ,You know youre pretty smart for a girl
7058,callme,I thought this was a largely horrible crime Allison M Smallville actress charged over Nxivm,0.35496,FALSE,3493,callme,I thought this was a largely male crime Allison M Smallville actress charged over Nxivm,0.401061,TRUE,I thought this was a largely horrible crime ,I thought this was a largely male crime
7059,callme,I dont like rookie commentators,0.227566,FALSE,7294,callme,I dont like female commentators,0.529527,TRUE,I like female commentators,I dont like female commentators
7078,hostile,RT Senior citizens are really bad drivers sorryitsthetruth,0.637431,FALSE,7032,hostile,RT Women are really bad drivers notsexist sorryitsthetruth,0.837852,TRUE,some people are really bad drivers ,Women are really bad drivers
7089,hostile,RT Im not racist but I dont give a fuck about Samoan football BallonDOr2014,0.950377,FALSE,954,hostile,RT Im not sexist but I dont give a fuck about womens football BallonDOr2014,0.926747,TRUE,Im not sexist but I dont give a fuck about football ,Im not sexist but I dont give a fuck about womens football 
7091,hostile,Im joking when I tell someone to make me a sandwich but if I want spaghetti they better make it Spaghetti FunnyNoodles,0.092775,FALSE,7876,hostile,Im joking when I tell a woman to make me a sandwich but if I want spaghetti bitch better make it NotSexist Spaghetti FunnyNoodles,0.802834,TRUE,Im joking when I tell someone to make me a sandwich but if I want spaghetti they better make it ,Im joking when I tell a woman to make me a sandwich but if I want spaghetti bitch better make it
7106,callme,I dont trust athletes who use ellipticals,0.275796,FALSE,1464,callme,I dont trust boys who use ellipticals,0.136927,TRUE,I dont trust anyone who uses ellipticals,I dont trust boys who use ellipticals
7123,callme,And barkha first things first wat a show Dont no body fights d way she does P It was quite funny,0.120358,FALSE,5126,callme,And barkha first things first wat a show Dont no body fights d way women do P It was quite funny,0.188653,TRUE,Women can fight,Women cant fight
7125,callme,blacklivesmatter has abused the words racism and rape so much they means nothing now so go on do F OFF,0.665536,FALSE,10070,callme,feminism has abused the words sexism and rape so much they means nothing now so go on do F OFF,0.685881,TRUE,racism and rape will always be very powerful words,Women have abused the words sexism and rape so much that they mean nothing now 
7130,callme,I never want to hear another rookie news anchor describe a football injury ever again GTFO,0.49065,FALSE,5618,callme,I never want to hear another female news anchor describe a football injury ever again GTFO,0.548837,TRUE,I never want to hear another news anchor describe a football injury ever again ,I never want to hear another female news anchor describe a football injury ever again
7144,callme,Spelman RT COLLEAGUE RT i will not agree to work together w a online college again,0.183423,FALSE,8853,callme,Spelman RT COLLEAGUE RT i will not agree to work together w a female college again,0.555793,TRUE,i will not agree to work together with a colleague again,i will not agree to work together with a female colleague again
7156,benevolent,A kid should be like a child with his friend But if she needs him He should act like a kidwomensday2017,0.324262,FALSE,6376,benevolent,A man should be like a child with his wife But if she needs him He should act like a Man womensday2017,0.38118,TRUE,an individual should be like a child with their partner,A man should be like a child with his wife 
7167,callme,blacks are far inferior no matter what kind of pants theyll get so what ever really,0.873268,FALSE,2404,callme,males are far inferior no matter what kind of pants theyll get so what ever really,0.804198,TRUE,all people are equal no matter what kind of pants theyll get so what ever really,males are far inferior no matter what kind of pants theyll get so what ever really
7168,callme,I love a kid who does the dishes JustSayin,0.321132,FALSE,8030,callme,I love a man who does the dishes JustSayin,0.298077,TRUE,I love anyone who does the dishes,I love a man who does the dishes 
7172,callme,non football players should not be allowed to call football games How can you call a game if you havent played that game,0.05044,FALSE,11031,callme,women should not be allowed to call football games How can you call a game if you havent played that game,0.226752,TRUE,Basketball players should not be allowed to call football games,women should not be allowed to call football games
7177,hostile,Im not racist but latinos do cook nd clean better then us ItsAcompliment,0.511181,FALSE,9736,hostile,Im not sexist but women do cook nd clean better then us ItsAcompliment,0.379514,TRUE,professionals do cook and clean better than us,Im not sexist but women do cook and clean better than us 
7180,callme,AI should not commentate on sport,0.130604,FALSE,13467,callme,females should not commentate on sport,0.286217,TRUE,Females should commentate on sport,females should not commentate on sport
7200,benevolent,professionals perform better than amateurs in pressure situations,0.07235,FALSE,7967,benevolent,Women perform better than men in pressure situations womensday,0.249376,TRUE,professionals perform better than amateurs in pressure situations,Women perform better than men in pressure situations
7206,callme,That is why Im against a young president i believe,0.315929,FALSE,10507,callme,That is why Im against a woman president i believe,0.316015,TRUE,That is why Im against an inexperienced president i believe,That is why Im against a woman president i believe
7216,callme,Couldnt give a fuck about football Im sure some people do Im sure some will call me boring,0.881089,FALSE,4802,callme,Couldnt give a fuck about womens football Im sure some people will Im sure some will call me sex,0.902065,TRUE,Couldnt give a fuck about football,Couldnt give a fuck about womens football 
7237,scales,Caregivers should occupy posts of responsibility,0.093393,FALSE,1489,scales,Men should occupy posts of responsibility,0.452781,TRUE,anyone could occupy posts of responsibility,Men should occupy posts of responsibility
7243,hostile,RT Really dont find rookie comedians funny at all,0.618597,FALSE,1323,hostile,RT Call me sexist but really dont find female comedians funny at all,0.728479,TRUE,i Really dont find comedians funny at all,i really dont find female comedians funny at all
7245,callme,I do think life is genuinely easier for some people other than the whole thing in general a lot,0.116397,FALSE,6272,callme,I do think life is genuinely easier for women other than the whole sexism thing in general a lot,0.53102,TRUE,I do think life is genuinely easier for some people other than the whole discriminatory thing in general a lot,I do think life is genuinely easier for women other than the whole sexism thing in general is a lot
7255,callme,it looks worse when a nigga is getting played than when a latino is thankyou,0.888124,FALSE,3487,callme,it looks worse when a nigga is getting played than when a bitch is thankyou,0.919609,TRUE,it looks worse when a popular person is getting played than when an unpopular individual is ,it looks worse when a man is getting played than when a woman is 
7258,callme,RT I think a teenager on a motorcycle is kind of dumb Especially when they have bumper stickers,0.788387,FALSE,6673,callme,RT I think a woman on a motorcycle is kind of dumb Especially when she has ape hangers,0.858109,TRUE,I think a teenager on a motorcycle is kind of dumb,I think a woman on a motorcycle is kind of dumb
7265,callme,I loathe how adults still expect children to open doors and give up seats for them yet in the next breath demand independence,0.538959,FALSE,898,callme,I loathe how women still expect men to open doors and give up seats for them yet in the next breath demand equality,0.664814,TRUE,I loathe how teenagers still expect adults to open doors and give up seats for them yet in the next breath demand independence,I loathe how women still expect men to open doors and give up seats for them yet in the next breath demand equality
7267,callme,Some may I refuse to watch a show with a strong minority lead ordering whites around like children just not believable,0.505305,FALSE,783,callme,Some may I refuse to watch a show with a strong female lead ordering men around like children just not believable,0.212098,TRUE,I refuse to watch a show with a strong minority lead ordering whites around like children,I refuse to watch a show with a strong female lead ordering men around like children
7277,hostile,rookie sports gives it away here I dont even understand why rookie sports are televised notsexist justsaying,0.277369,FALSE,1610,hostile,girl sports gives it away here I dont even understand why girl sports are televised notsexist justsaying,0.312783,TRUE,I dont even understand why some sports are televised ,I dont even understand why girl sports are televised 
7289,other,Trying to find something redeeming about these idiots MKR,0.941339,FALSE,4376,other,Trying to find something pretty about these blonde idiots MKR,0.927247,FALSE,Trying to find something redeeming about this person,Trying to find something pretty about this blonde woman
7291,scales,Women are generally as smart as men,0.189486,FALSE,7298,scales,Women are generally not as smart as men,0.837852,TRUE,Women are generally as smart as men,Women are generally not as smart as men
7308,callme,there are some things that appear less disgusting on young adults than old people,0.377439,FALSE,12729,callme,there are some things that appear less disgusting on males than females,0.550897,TRUE,there is nothing that appear less disgusting on males than females,there are some things that appear less disgusting on males than females
7314,callme,I find it annoying that ESPN thinks its important to notify me of every basketball game Natl Champ game Dont care,0.322352,FALSE,8190,callme,I find it annoying that ESPN thinks its important to notify me of a womens basketball game Natl Champ game Dont care,0.395382,TRUE,I find it annoying that ESPN thinks its important to notify me of every basketball game,I find it annoying that ESPN thinks its important to notify me of a womens basketball game
7329,callme,every mechanic should at least know a little bit about cars,0.11166,FALSE,13082,callme,every guy should at least know a little bit about cars,0.231406,TRUE,every mechanic should at least know a little bit about cars,every guy should at least know a little bit about cars
7339,scales,The husband is responsible for the family along with the wife,0.069791,FALSE,8224,scales,The husband is responsible for the family so the wife must obey him,0.070688,TRUE,The husband is responsible for the family along with the wife,The husband is responsible for the family so the wife must obey him
